{
  "$schema": "https://json-schema.org/draft/2020-12/schema",
  "$id": "https://usvds.invalid/schemas/v10/story-package.schema.json",
  "title": "USVDS V10 Story Package",
  "description": "Canonical project story truth. Markdown is a generated reading view; review and human approval are separately bound to this package revision and digest.",
  "type": "object",
  "required": ["schema_version", "project_id", "artifact_id", "revision", "parent_revision", "status", "brief_ref", "selected_direction_id", "source_refs", "adaptation_mechanism_map", "story_promise", "logline", "story_engine", "full_story_outline", "characters", "relationships", "state_definitions", "season_arc", "episodes", "canon_facts", "secrets", "promises", "narrative_asset_requirements", "provenance"],
  "properties": {
    "schema_version": { "const": "usvd-story-package/v2" },
    "project_id": { "type": "string", "minLength": 1 },
    "artifact_id": { "type": "string", "minLength": 1 },
    "revision": { "type": "integer", "minimum": 1 },
    "parent_revision": { "type": ["integer", "null"], "minimum": 1 },
    "status": { "enum": ["DRAFT", "REVIEW_REQUIRED", "HUMAN_APPROVAL_REQUIRED", "APPROVED", "CHANGE_REQUESTED", "SUPERSEDED", "STALE"] },
    "brief_ref": { "$ref": "#/$defs/artifactRef" },
    "selected_direction_id": { "type": "string", "minLength": 1, "description": "Must equal direction_selection.selected_direction_id in the exact referenced BRIEF_READY Project Brief revision; this is a reference, not an independent selection." },
    "source_refs": { "type": "array", "items": { "$ref": "#/$defs/sourceRef" } },
    "adaptation_mechanism_map": { "type": "array", "description": "Empty for original ideas. Source adaptation requires mechanism-level replacement for story-driving power, relationship, cost, and causality, with source and provenance binding.", "items": { "type": "object", "required": ["dimension", "source_ref", "emotional_payoff", "source_mechanism", "us_mechanism", "us_plausibility", "protagonist_choice", "cost_or_consequence", "decision_status", "provenance"], "properties": { "dimension": { "enum": ["power", "relationship", "cost", "causality"] }, "source_ref": { "type": "string", "minLength": 1 }, "emotional_payoff": { "type": "string", "minLength": 1 }, "source_mechanism": { "type": "string", "minLength": 1 }, "us_mechanism": { "type": "string", "minLength": 1 }, "us_plausibility": { "type": "string", "minLength": 1 }, "protagonist_choice": { "type": "string", "minLength": 1 }, "cost_or_consequence": { "type": "string", "minLength": 1 }, "decision_status": { "enum": ["user_decided", "ai_proposal", "unresolved"] }, "provenance": { "$ref": "#/$defs/provenance" } }, "additionalProperties": false } },
    "story_promise": { "type": "object", "required": ["audience_reason_to_continue", "protagonist_desire", "central_obstacle", "emotional_experience", "core_payoff", "central_question"], "properties": { "audience_reason_to_continue": { "type": "string", "minLength": 1 }, "protagonist_desire": { "type": "string", "minLength": 1 }, "central_obstacle": { "type": "string", "minLength": 1 }, "emotional_experience": { "type": "string", "minLength": 1 }, "core_payoff": { "type": "string", "minLength": 1 }, "central_question": { "type": "string", "minLength": 1 } }, "additionalProperties": false },
    "logline": { "type": "object", "required": ["who", "wants", "against", "stakes", "sentence"], "properties": { "who": { "type": "string", "minLength": 1 }, "wants": { "type": "string", "minLength": 1 }, "against": { "type": "string", "minLength": 1 }, "stakes": { "type": "string", "minLength": 1 }, "sentence": { "type": "string", "minLength": 1 } }, "additionalProperties": false },
    "story_engine": { "type": "object", "required": ["protagonist_id", "opposing_force_id", "external_goal", "internal_need", "conflict_engine", "us_power_logic", "opposing_leverage", "protagonist_available_action", "cost_of_action", "escalation_mechanism", "stakes", "pressure_source", "reversal_sources", "episode_hook_sources", "sustainability_explanation"], "properties": { "protagonist_id": { "type": "string" }, "opposing_force_id": { "type": "string" }, "external_goal": { "type": "string", "minLength": 1 }, "internal_need": { "type": "string", "minLength": 1 }, "conflict_engine": { "type": "string", "minLength": 1 }, "us_power_logic": { "type": "string", "minLength": 1 }, "opposing_leverage": { "type": "string", "minLength": 1 }, "protagonist_available_action": { "type": "string", "minLength": 1 }, "cost_of_action": { "type": "string", "minLength": 1 }, "escalation_mechanism": { "type": "string", "minLength": 1 }, "stakes": { "type": "string", "minLength": 1 }, "pressure_source": { "type": "string", "minLength": 1 }, "reversal_sources": { "type": "array", "items": { "type": "string" }, "minItems": 1 }, "episode_hook_sources": { "type": "array", "items": { "type": "string" }, "minItems": 1 }, "sustainability_explanation": { "type": "string", "minLength": 1 } }, "additionalProperties": false },
    "full_story_outline": { "type": "object", "required": ["beginning", "development", "escalation", "major_reversal", "crisis", "climax", "resolution"], "properties": { "beginning": { "$ref": "#/$defs/prose" }, "development": { "$ref": "#/$defs/prose" }, "escalation": { "$ref": "#/$defs/prose" }, "major_reversal": { "$ref": "#/$defs/prose" }, "crisis": { "$ref": "#/$defs/prose" }, "climax": { "$ref": "#/$defs/prose" }, "resolution": { "$ref": "#/$defs/prose" } }, "additionalProperties": false },
    "characters": { "type": "array", "items": { "type": "object", "required": ["id", "identity", "visible_goal", "hidden_need", "fear", "secret_refs", "weakness", "strength", "leverage", "protagonist_relationship", "conflict_function", "transformation", "provenance"], "properties": { "id": { "type": "string", "minLength": 1 }, "identity": { "type": "string", "minLength": 1 }, "visible_goal": { "type": "string", "minLength": 1 }, "hidden_need": { "type": "string", "minLength": 1 }, "fear": { "type": "string", "minLength": 1 }, "secret_refs": { "type": "array", "items": { "type": "string" } }, "weakness": { "type": "string", "minLength": 1 }, "strength": { "type": "string", "minLength": 1 }, "leverage": { "type": "string", "minLength": 1 }, "protagonist_relationship": { "type": "string", "minLength": 1 }, "conflict_function": { "type": "string", "minLength": 1 }, "transformation": { "type": "string", "minLength": 1 }, "provenance": { "$ref": "#/$defs/provenance" } }, "additionalProperties": false } },
    "relationships": { "type": "array", "items": { "type": "object", "required": ["id", "from_character_id", "to_character_id", "alliance", "opposition", "dependency", "leverage", "betrayal_potential", "emotional_bond", "provenance"], "properties": { "id": { "type": "string" }, "from_character_id": { "type": "string" }, "to_character_id": { "type": "string" }, "alliance": { "type": "string" }, "opposition": { "type": "string" }, "dependency": { "type": "string" }, "leverage": { "type": "string" }, "betrayal_potential": { "type": "string" }, "emotional_bond": { "type": "string" }, "provenance": { "$ref": "#/$defs/provenance" } }, "additionalProperties": false } },
    "state_definitions": { "type": "array", "items": { "type": "object", "required": ["character_id", "states", "transitions"], "properties": { "character_id": { "type": "string" }, "states": { "type": "array", "items": { "type": "string" }, "minItems": 1 }, "transitions": { "type": "array", "items": { "type": "object", "required": ["from", "to", "cause_ref"], "properties": { "from": { "type": "string" }, "to": { "type": "string" }, "cause_ref": { "type": "string" } }, "additionalProperties": false } } }, "additionalProperties": false } },
    "season_arc": { "type": "object", "required": ["season_id", "episode_count", "season_question", "major_turns", "reveal_windows", "finale_outcome", "unresolved_promises"], "properties": { "season_id": { "type": "string" }, "episode_count": { "type": "integer", "minimum": 1 }, "season_question": { "type": "string", "minLength": 1 }, "major_turns": { "type": "array", "items": { "$ref": "#/$defs/majorTurn" } }, "reveal_windows": { "type": "array", "items": { "$ref": "#/$defs/plannedTurn" } }, "finale_outcome": { "type": "string", "minLength": 1 }, "unresolved_promises": { "type": "array", "items": { "type": "string" } } }, "additionalProperties": false },
    "episodes": { "type": "array", "items": { "$ref": "episode-entry.schema.json" } },
    "canon_facts": { "type": "array", "items": { "$ref": "#/$defs/provenancedFact" } },
    "secrets": { "type": "array", "items": { "type": "object", "required": ["id", "holder_ids", "known_by", "planned_reveal", "provenance"], "properties": { "id": { "type": "string" }, "holder_ids": { "type": "array", "items": { "type": "string" } }, "known_by": { "type": "array", "items": { "type": "string" } }, "planned_reveal": { "type": ["string", "null"] }, "provenance": { "$ref": "#/$defs/provenance" } }, "additionalProperties": false } },
    "promises": { "type": "array", "items": { "$ref": "#/$defs/provenancedFact" } },
    "narrative_asset_requirements": { "type": "array", "items": { "type": "object", "required": ["id", "kind", "story_function", "first_needed_ref", "provenance"], "properties": { "id": { "type": "string" }, "kind": { "enum": ["character", "costume", "prop", "vehicle", "location", "story_critical_object"] }, "story_function": { "type": "string", "minLength": 1 }, "first_needed_ref": { "type": "string" }, "provenance": { "$ref": "#/$defs/provenance" } }, "additionalProperties": false } },
    "provenance": { "type": "array", "items": { "$ref": "#/$defs/provenance" } },
    "approval_ref": { "$ref": "#/$defs/approvalRef" }
  },
  "$defs": {
    "prose": { "type": "string", "minLength": 1, "description": "Connected narrative prose; completeness and causal sufficiency are semantic review responsibilities, not character-count checks." },
    "artifactRef": { "type": "object", "required": ["artifact_id", "revision", "digest"], "properties": { "artifact_id": { "type": "string" }, "revision": { "type": "integer", "minimum": 1 }, "digest": { "type": "string", "pattern": "^[a-f0-9]{64}$" } }, "additionalProperties": false },
    "sourceRef": { "type": "object", "required": ["source_id", "locator", "coverage_status"], "properties": { "source_id": { "type": "string" }, "locator": { "type": "string" }, "coverage_status": { "enum": ["supplied", "observed", "partial", "unavailable"] } }, "additionalProperties": false },
    "provenance": { "type": "object", "required": ["decision_id", "kind", "statement"], "properties": { "decision_id": { "type": "string" }, "kind": { "enum": ["user", "source", "market_evidence", "ai_proposal", "approved_story"] }, "statement": { "type": "string", "minLength": 1 }, "source_ref": { "type": "string" }, "date": { "type": "string", "format": "date" } }, "additionalProperties": false },
    "provenancedFact": { "type": "object", "required": ["id", "statement", "provenance"], "properties": { "id": { "type": "string" }, "statement": { "type": "string", "minLength": 1 }, "provenance": { "$ref": "#/$defs/provenance" } }, "additionalProperties": false },
    "plannedTurn": { "type": "object", "required": ["id", "summary", "episode_window", "cause_refs", "provenance"], "properties": { "id": { "type": "string" }, "summary": { "type": "string", "minLength": 1 }, "episode_window": { "type": "string" }, "cause_refs": { "type": "array", "items": { "type": "string" } }, "provenance": { "$ref": "#/$defs/provenance" } }, "additionalProperties": false },
    "majorTurn": { "type": "object", "required": ["id", "summary", "episode_window", "cause_refs", "protagonist_choice", "opposing_counteraction", "cost_or_state_change", "next_pressure", "provenance"], "properties": { "id": { "type": "string", "minLength": 1 }, "summary": { "type": "string", "minLength": 1 }, "episode_window": { "type": "string" }, "cause_refs": { "type": "array", "items": { "type": "string" }, "minItems": 1 }, "protagonist_choice": { "type": "string", "minLength": 1 }, "opposing_counteraction": { "type": "string", "minLength": 1 }, "cost_or_state_change": { "type": "string", "minLength": 1 }, "next_pressure": { "type": "string", "minLength": 1 }, "provenance": { "$ref": "#/$defs/provenance" } }, "additionalProperties": false },
    "approvalRef": { "type": "object", "required": ["approval_id", "revision", "digest", "scope"], "properties": { "approval_id": { "type": "string" }, "revision": { "type": "integer", "minimum": 1 }, "digest": { "type": "string", "pattern": "^[a-f0-9]{64}$" }, "scope": { "type": "string" } }, "additionalProperties": false }
  },
  "additionalProperties": false
}
